{"allocation_exact":true,"allocation_id":"chatgnt-dataset-split-v1","candidate_counts":{"accepted":200,"rejected":0,"total":200},"dataset_contract_id":"chatgnt-dataset-v1","deviation_scenario_ids":[],"output_sha256":{"candidates":"af3e6ae0d1cdc756e57adf5ba2950b256c70ea0423fb894b0d21f44d4ef59b97","pilot":"a8e4ad6ea6923c18e1111d16c00c07b40004d9533c04d32d6550edf2521565dd","train":"1690561db24ba4d2ae3c56f0ba4e988643994cb2add51f01beef901ebf5095b2","validation":"b9e344f6582a9ebe4d9b83801cf71acc2abf2c4f95efd71bcd58eafbfb36bdc5"},"per_intent_family":{"advice_decision_support":{"pilot":8,"train":32,"validation":8},"creative_generation":{"pilot":8,"train":32,"validation":8},"explanation_technical_understanding":{"pilot":8,"train":32,"validation":8},"low_stakes_emotional_support":{"pilot":8,"train":32,"validation":8},"short_form_transformation":{"pilot":8,"train":32,"validation":8}},"pilot_algorithm_id":"greedy-coverage-hash-tie-v1","pilot_coverage":{"complexities":["composed","standard"],"constraint_bearing":true,"coverage_slices":["breadth","robustness","target_use"],"input_forms":["direct_request_or_command","question","statement_or_fragment"],"robustness_roles":["behaviour_pressure","format_pressure","serialization_pressure"],"task_subtype_count":35,"topic_count":16},"pilot_example_ids":["dataset-v1-004","dataset-v1-007","dataset-v1-008","dataset-v1-010","dataset-v1-025","dataset-v1-030","dataset-v1-034","dataset-v1-038","dataset-v1-046","dataset-v1-048","dataset-v1-050","dataset-v1-052","dataset-v1-053","dataset-v1-058","dataset-v1-062","dataset-v1-063","dataset-v1-074","dataset-v1-076","dataset-v1-078","dataset-v1-082","dataset-v1-084","dataset-v1-090","dataset-v1-091","dataset-v1-092","dataset-v1-094","dataset-v1-101","dataset-v1-104","dataset-v1-109","dataset-v1-117","dataset-v1-136","dataset-v1-150","dataset-v1-156","dataset-v1-160","dataset-v1-166","dataset-v1-180","dataset-v1-195","dataset-v1-199","dataset-v1-203","dataset-v1-207","dataset-v1-209"],"record_schema_version":1,"scenario_count":200,"seed":20260715,"source_sha256":{"candidates":"8614785cf7988e437ad4e59a182c6abceb2dd2428197c03fd275370422d94ff5","events":"9fb18167271982dd808a0b3d5892050952e97366188dd77cdb8f140cca4c86f9"},"split_counts":{"pilot":40,"train":160,"validation":40},"split_deviation_required":false,"validation_algorithm_id":"scenario-dp-coverage-v1","validation_coverage":{"complexities":["composed","standard"],"constraint_bearing":true,"coverage_slices":["breadth","robustness","target_use"],"input_forms":["direct_request_or_command","question","statement_or_fragment"],"robustness_roles":["behaviour_pressure","format_pressure","serialization_pressure"],"task_subtype_count":22,"topic_count":14},"validation_scenario_ids":["scenario-1800s-nineteenth-century-numbering","scenario-allotment-or-balcony-three-factor-format","scenario-bicycle-repair-pop-up-seven-word-slogan","scenario-bluetooth-connected-no-sound","scenario-book-club-or-solo-reading","scenario-card-payment-pending-then-complete","scenario-cleanup-volunteer-guilt-boundary","scenario-colleague-late-message-boundary","scenario-curt-text-serialization-reframe","scenario-donating-childhood-collection-mixed-feelings","scenario-evening-recital-lobby-announcement","scenario-family-recipe-headnote-archive-caption","scenario-first-local-archive-visit","scenario-first-local-history-evening-hosting","scenario-forgotten-classmate-name-behaviour-pressure","scenario-friends-savings-comparison-shame","scenario-household-chore-labels-serialization","scenario-leaving-group-chat-guilt","scenario-library-call-number-location","scenario-local-park-dusk-sound-event","scenario-market-stall-return-line-shortening","scenario-new-team-five-minute-ritual","scenario-number-pattern-family-activity","scenario-paper-digital-study-planner-choice","scenario-park-trail-etiquette-shortening","scenario-party-social-nerves","scenario-quoted-draft-path-recovery-nerves","scenario-rainy-day-community-experience","scenario-repair-service-blurb-constraint-rewrite","scenario-router-restart-beginner-rewrite","scenario-shared-office-headphones-or-earplugs","scenario-spreadsheet-freeze-header-row","scenario-symmetry-household-demonstrations","scenario-sync-pause-path-support-update-serialization","scenario-sync-versus-backup-recovery","scenario-tempo-versus-rhythm","scenario-tool-sharing-tagline","scenario-volunteer-shift-reminder","scenario-weekend-soup-club-name-flight","scenario-weighted-average-course-marks"]}
